{
  "schema_version": "BreathVOC-1.1",
  "generated_utc": "2026-08-09T19:32:35.213112+00:00",
  "study_id": "ST000883",
  "disease_id": "malaria",
  "disease_name": "Malaria",
  "modality": "gcms",
  "unit": "gcms_intensity",
  "matrix": {
    "Patient 1": {
      "2_butanone": 1.0,
      "2_pentanone": 1.0,
      "acetone": 3407029.0,
      "alpha_pinene": 21217.0,
      "benzene": 484502.0,
      "butane": 1.0,
      "cyclohexanone": 24620.0,
      "delta_3_carene": 1.0,
      "ethanol": 1.0,
      "ethylbenzene": 1.0,
      "heptanal": 1.0,
      "hexanal": 1.0,
      "hexane": 1.0,
      "isoprene": 149362.0,
      "isopropanol": 467803.0,
      "methyl_undecane": 26176.0,
      "nonanal": 93175.0,
      "octane": 1.0,
      "pentane": 1.0,
      "propanol": 1.0,
      "toluene": 396990.0,
      "tridecane": 45029.0,
      "trimethyl_alkene": 1.0,
      "trimethyl_decane": 19573.0,
      "xylene": 37868.0
    },
    "Patient 2": {
      "2_butanone": 76223.0,
      "2_pentanone": 1.0,
      "acetone": 4955740.0,
      "alpha_pinene": 29790.0,
      "benzene": 643718.0,
      "butane": 6162.5,
      "cyclohexanone": 27924.5,
      "delta_3_carene": 1.0,
      "ethanol": 1.0,
      "ethylbenzene": 21803.0,
      "heptanal": 1.0,
      "hexanal": 1.0,
      "hexane": 28003.0,
      "isoprene": 914323.0,
      "isopropanol": 292583.0,
      "methyl_undecane": 41892.0,
      "nonanal": 514595.0,
      "octane": 112878.5,
      "pentane": 11001.0,
      "propanol": 1.0,
      "toluene": 454508.0,
      "tridecane": 88203.0,
      "trimethyl_alkene": 8991.5,
      "trimethyl_decane": 24097.0,
      "xylene": 92439.0
    },
    "Patient 3": {
      "2_butanone": 138516.0,
      "2_pentanone": 1.0,
      "acetone": 22357518.0,
      "alpha_pinene": 1.0,
      "benzene": 677172.0,
      "butane": 1.0,
      "cyclohexanone": 16251.0,
      "delta_3_carene": 1.0,
      "ethanol": 1.0,
      "ethylbenzene": 15708.0,
      "heptanal": 1.0,
      "hexanal": 36730.5,
      "hexane": 1.0,
      "isoprene": 688272.0,
      "isopropanol": 547123.0,
      "methyl_undecane": 27766.0,
      "nonanal": 346217.0,
      "octane": 55301.0,
      "pentane": 1.0,
      "propanol": 1.0,
      "toluene": 486031.0,
      "tridecane": 57564.0,
      "trimethyl_alkene": 1.0,
      "trimethyl_decane": 29156.5,
      "xylene": 34536.5
    },
    "Patient 4": {
      "2_butanone": 27574.0,
      "2_pentanone": 1.0,
      "acetone": 1433295.0,
      "alpha_pinene": 1.0,
      "benzene": 658560.0,
      "butane": 1.0,
      "cyclohexanone": 14652.5,
      "delta_3_carene": 1.0,
      "ethanol": 1.0,
      "ethylbenzene": 10023.0,
      "heptanal": 1.0,
      "hexanal": 119332.0,
      "hexane": 16383.0,
      "isoprene": 210803.0,
      "isopropanol": 457535.0,
      "methyl_undecane": 54406.0,
      "nonanal": 383613.0,
      "octane": 66272.5,
      "pentane": 14486.0,
      "propanol": 9056.0,
      "toluene": 550741.0,
      "tridecane": 43411.0,
      "trimethyl_alkene": 22446.0,
      "trimethyl_decane": 43016.0,
      "xylene": 34787.0
    },
    "Patient 5": {
      "2_butanone": 35775.0,
      "2_pentanone": 1.0,
      "acetone": 5274652.0,
      "alpha_pinene": 1.0,
      "benzene": 481480.0,
      "butane": 1.0,
      "cyclohexanone": 25103.0,
      "delta_3_carene": 1.0,
      "ethanol": 1.0,
      "ethylbenzene": 1.0,
      "heptanal": 1.0,
      "hexanal": 1.0,
      "hexane": 1.0,
      "isoprene": 259212.0,
      "isopropanol": 249607.0,
      "methyl_undecane": 1.0,
      "nonanal": 291563.0,
      "octane": 50524.5,
      "pentane": 1.0,
      "propanol": 1.0,
      "toluene": 414511.0,
      "tridecane": 49421.0,
      "trimethyl_alkene": 18062.0,
      "trimethyl_decane": 1.0,
      "xylene": 1.0
    },
    "Patient 6": {
      "2_butanone": 45902.0,
      "2_pentanone": 1.0,
      "acetone": 2711273.0,
      "alpha_pinene": 24415.0,
      "benzene": 759169.0,
      "butane": 1.0,
      "cyclohexanone": 12081.5,
      "delta_3_carene": 11112.0,
      "ethanol": 1.0,
      "ethylbenzene": 1.0,
      "heptanal": 1.0,
      "hexanal": 39786.0,
      "hexane": 23509.0,
      "isoprene": 145193.0,
      "isopropanol": 252184.0,
      "methyl_undecane": 1.0,
      "nonanal": 357018.0,
      "octane": 14015.0,
      "pentane": 10325.0,
      "propanol": 1.0,
      "toluene": 678104.0,
      "tridecane": 60693.0,
      "trimethyl_alkene": 14546.5,
      "trimethyl_decane": 30059.0,
      "xylene": 46051.5
    },
    "Patient 7": {
      "2_butanone": 30200.0,
      "2_pentanone": 1.0,
      "acetone": 1042492.0,
      "alpha_pinene": 37960.0,
      "benzene": 818979.0,
      "butane": 1.0,
      "cyclohexanone": 19425.5,
      "delta_3_carene": 33838.0,
      "ethanol": 1.0,
      "ethylbenzene": 1.0,
      "heptanal": 1.0,
      "hexanal": 34090.5,
      "hexane": 27375.0,
      "isoprene": 1055319.0,
      "isopropanol": 888856.0,
      "methyl_undecane": 1.0,
      "nonanal": 446807.0,
      "octane": 99062.0,
      "pentane": 15030.0,
      "propanol": 1.0,
      "toluene": 608657.0,
      "tridecane": 71379.0,
      "trimethyl_alkene": 32772.0,
      "trimethyl_decane": 39637.0,
      "xylene": 59270.5
    },
    "Patient 8": {
      "2_butanone": 234441.0,
      "2_pentanone": 1.0,
      "acetone": 46143232.0,
      "alpha_pinene": 30795.0,
      "benzene": 569505.0,
      "butane": 1.0,
      "cyclohexanone": 84458.0,
      "delta_3_carene": 65274.0,
      "ethanol": 1.0,
      "ethylbenzene": 1.0,
      "heptanal": 1.0,
      "hexanal": 68902.0,
      "hexane": 1.0,
      "isoprene": 62589.0,
      "isopropanol": 1394757.0,
      "methyl_undecane": 64710.0,
      "nonanal": 515498.0,
      "octane": 129791.0,
      "pentane": 1.0,
      "propanol": 1.0,
      "toluene": 367582.0,
      "tridecane": 109398.0,
      "trimethyl_alkene": 22120.5,
      "trimethyl_decane": 35894.5,
      "xylene": 72498.0
    },
    "Patient 9": {
      "2_butanone": 95474.0,
      "2_pentanone": 1.0,
      "acetone": 1.0,
      "alpha_pinene": 44153.0,
      "benzene": 792299.0,
      "butane": 1.0,
      "cyclohexanone": 19984.5,
      "delta_3_carene": 27542.0,
      "ethanol": 1.0,
      "ethylbenzene": 1.0,
      "heptanal": 1.0,
      "hexanal": 20695.0,
      "hexane": 1.0,
      "isoprene": 908753.0,
      "isopropanol": 83093.0,
      "methyl_undecane": 52686.0,
      "nonanal": 424697.0,
      "octane": 72097.0,
      "pentane": 17712.0,
      "propanol": 6057.0,
      "toluene": 590191.0,
      "tridecane": 75445.0,
      "trimethyl_alkene": 13700.5,
      "trimethyl_decane": 17115.5,
      "xylene": 6756.5
    },
    "Patient 10": {
      "2_butanone": 66381.0,
      "2_pentanone": 1.0,
      "acetone": 8302463.0,
      "alpha_pinene": 23158.0,
      "benzene": 538084.0,
      "butane": 1.0,
      "cyclohexanone": 88447.5,
      "delta_3_carene": 33088.0,
      "ethanol": 1.0,
      "ethylbenzene": 11956.0,
      "heptanal": 1.0,
      "hexanal": 92219.0,
      "hexane": 23506.0,
      "isoprene": 741464.0,
      "isopropanol": 661242.0,
      "methyl_undecane": 24980.0,
      "nonanal": 341116.0,
      "octane": 61123.5,
      "pentane": 1.0,
      "propanol": 1.0,
      "toluene": 413096.0,
      "tridecane": 42031.0,
      "trimethyl_alkene": 12003.0,
      "trimethyl_decane": 24460.5,
      "xylene": 1.0
    },
    "Patient 11": {
      "2_butanone": 28189.0,
      "2_pentanone": 1.0,
      "acetone": 957688.0,
      "alpha_pinene": 1.0,
      "benzene": 645637.0,
      "butane": 1.0,
      "cyclohexanone": 1.0,
      "delta_3_carene": 84963.0,
      "ethanol": 12650.0,
      "ethylbenzene": 1.0,
      "heptanal": 16017.0,
      "hexanal": 113951.5,
      "hexane": 62854.0,
      "isoprene": 313314.0,
      "isopropanol": 68842.0,
      "methyl_undecane": 35601.0,
      "nonanal": 518677.0,
      "octane": 102807.5,
      "pentane": 10658.0,
      "propanol": 5799.5,
      "toluene": 450398.0,
      "tridecane": 105530.0,
      "trimethyl_alkene": 1.0,
      "trimethyl_decane": 6457.5,
      "xylene": 93604.5
    },
    "Patient 12": {
      "2_butanone": 55950.0,
      "2_pentanone": 1.0,
      "acetone": 7010296.0,
      "alpha_pinene": 36022.0,
      "benzene": 595804.0,
      "butane": 1.0,
      "cyclohexanone": 1.0,
      "delta_3_carene": 1.0,
      "ethanol": 1.0,
      "ethylbenzene": 1.0,
      "heptanal": 1.0,
      "hexanal": 32104.0,
      "hexane": 28918.0,
      "isoprene": 713099.0,
      "isopropanol": 646994.0,
      "methyl_undecane": 1.0,
      "nonanal": 396469.0,
      "octane": 83957.5,
      "pentane": 1.0,
      "propanol": 1.0,
      "toluene": 435529.0,
      "tridecane": 62236.0,
      "trimethyl_alkene": 35674.0,
      "trimethyl_decane": 24643.5,
      "xylene": 50912.5
    },
    "Patient 13": {
      "2_butanone": 54598.0,
      "2_pentanone": 1.0,
      "acetone": 1650520.0,
      "alpha_pinene": 48778.0,
      "benzene": 1256920.0,
      "butane": 8060.5,
      "cyclohexanone": 27805.0,
      "delta_3_carene": 78219.0,
      "ethanol": 1.0,
      "ethylbenzene": 90869.0,
      "heptanal": 42044.0,
      "hexanal": 364676.5,
      "hexane": 31057.0,
      "isoprene": 1420452.0,
      "isopropanol": 177894.0,
      "methyl_undecane": 42012.0,
      "nonanal": 606894.0,
      "octane": 97595.0,
      "pentane": 25968.0,
      "propanol": 1.0,
      "toluene": 1109062.0,
      "tridecane": 87748.0,
      "trimethyl_alkene": 60409.5,
      "trimethyl_decane": 1.0,
      "xylene": 165447.5
    },
    "Patient 14": {
      "2_butanone": 108390.0,
      "2_pentanone": 1.0,
      "acetone": 17133448.0,
      "alpha_pinene": 33553.0,
      "benzene": 709975.0,
      "butane": 6373.0,
      "cyclohexanone": 1.0,
      "delta_3_carene": 14186.0,
      "ethanol": 1.0,
      "ethylbenzene": 1.0,
      "heptanal": 1.0,
      "hexanal": 143382.0,
      "hexane": 11855.0,
      "isoprene": 701816.0,
      "isopropanol": 440994.0,
      "methyl_undecane": 35473.0,
      "nonanal": 592370.0,